{"commit_sha":"df40a9683004ab58fb38497d1aecfc8f1fffa288","gates":[{"artifact_path":"docs/research/v2-stable-roadmap.md","artifact_sha256":"67a568cf6f72a5755f17fcdb835fec8d08711cd9151039aab2d9f04415ad5f73","command":"git diff --check","commit_sha":"df40a9683004ab58fb38497d1aecfc8f1fffa288","dimension":"architecture","environment":"macOS Darwin; Python 3.14.6; Node 24.19.0; uv 0.12.3; uv frozen; working tree changes present","gate_id":"architecture.roadmap","limitation":null,"references":["docs/research/v2-stable-roadmap.md"],"required":true,"result":"roadmap recorded","status":"passed","utc_date":"2026-08-12"},{"artifact_path":"artifacts/golden-bundle/manifest.json","artifact_sha256":"1f1f42f2780c67cd41aa3caf5b3d333be3e8575f9a3f68280900fd43b070861f","command":"uv run --frozen pytest tests/test_store.py tests/test_workflow.py","commit_sha":"df40a9683004ab58fb38497d1aecfc8f1fffa288","dimension":"architecture","environment":"macOS Darwin; Python 3.14.6; Node 24.19.0; uv 0.12.3; uv frozen; working tree changes present","gate_id":"architecture.state-policy-tests","limitation":null,"references":["tests/test_store.py","tests/test_workflow.py"],"required":true,"result":"focused state/policy tests passed","status":"passed","utc_date":"2026-08-12"},{"artifact_path":"docs/architecture.md","artifact_sha256":"a634817b84f6bfbadcbcd8f669184bc0f078b7ccc8a9b97f8d8421e124238582","command":"uv run --frozen pytest tests/test_package_boundaries.py","commit_sha":"df40a9683004ab58fb38497d1aecfc8f1fffa288","dimension":"architecture","environment":"macOS Darwin; Python 3.14.6; Node 24.19.0; uv 0.12.3; uv frozen; working tree changes present","gate_id":"architecture.dependency-boundaries","limitation":null,"references":["tests/test_package_boundaries.py","docs/architecture.md"],"required":true,"result":"packaging boundary regression passed; logical contexts are documented against shipped modules","status":"passed","utc_date":"2026-08-12"},{"artifact_path":"docs/research/frontend-v2-stable-results.json","artifact_sha256":"60a967ddeaaf4e4909da6ef69cb83caccd8d9aa244e474a8c6b5f510798902c7","command":"uv run --frozen pytest tests/test_api.py tests/test_service.py","commit_sha":"df40a9683004ab58fb38497d1aecfc8f1fffa288","dimension":"architecture","environment":"macOS Darwin; Python 3.14.6; Node 24.19.0; uv 0.12.3; uv frozen; working tree changes present","gate_id":"architecture.api-sse-contract","limitation":null,"references":["tests/test_api.py","tests/test_service.py","src/qed/api.py"],"required":true,"result":"typed API, idempotent command, replay, bounded SSE, and slow-client behavior tests passed","status":"passed","utc_date":"2026-08-12"},{"artifact_path":"artifacts/golden-bundle/manifest.json","artifact_sha256":"1f1f42f2780c67cd41aa3caf5b3d333be3e8575f9a3f68280900fd43b070861f","command":"uv run --frozen pytest tests/test_bundle_verifier.py tests/test_golden_bundle.py","commit_sha":"df40a9683004ab58fb38497d1aecfc8f1fffa288","dimension":"architecture","environment":"macOS Darwin; Python 3.14.6; Node 24.19.0; uv 0.12.3; uv frozen; working tree changes present","gate_id":"architecture.offline-bundle-contract","limitation":null,"references":["src/qed/bundle_verifier.py","tests/test_bundle_verifier.py"],"required":true,"result":"offline verifier tests passed","status":"passed","utc_date":"2026-08-12"},{"artifact_path":"docs/research/coverage-v2-stable.json","artifact_sha256":"d6bc971200ad4453a981cedcc2d16b258b8def2dbe3fca8b64cea4a50c1f0d38","command":"uv run --frozen pytest --cov=qed --cov-branch","commit_sha":"df40a9683004ab58fb38497d1aecfc8f1fffa288","dimension":"architecture","environment":"macOS Darwin; Python 3.14.6; Node 24.19.0; uv 0.12.3; uv frozen; working tree changes present","gate_id":"architecture.coverage","limitation":"Core measured 98.10% line / 93.99% branch and passes its target. Repository measured 88.19% line / 72.30% branch; repository target is line >=90% and branch >=85%.","references":["scripts/check_coverage.py"],"required":true,"result":"repository coverage remains below the stable target; core coverage passed","status":"failed","utc_date":"2026-08-12"},{"artifact_path":"docs/research/mutation-v2-stable.json","artifact_sha256":"bdefa6b16f2296fe7b156a00c51584deb63cadfcb9f4648078e1ca870c6039cc","command":"uv run --frozen mutmut run --max-children 2","commit_sha":"df40a9683004ab58fb38497d1aecfc8f1fffa288","dimension":"architecture","environment":"macOS Darwin; Python 3.14.6; Node 24.19.0; uv 0.12.3; uv frozen; working tree changes present","gate_id":"architecture.mutation","limitation":"The required core mutation score is >=90%; surviving mutations remain a code blocker.","references":["docs/research/mutation-v2-stable.json"],"required":true,"result":"1232/2138 executable mutants killed; mutation score 57.62%","status":"failed","utc_date":"2026-08-12"},{"artifact_path":"docs/threat-model.md","artifact_sha256":"62d04f51e53901481c8777507613cc7bda3900e0b292302451e53934c54aaa7a","command":"uv run --frozen pytest tests/test_security_boundaries.py","commit_sha":"df40a9683004ab58fb38497d1aecfc8f1fffa288","dimension":"security","environment":"macOS Darwin; Python 3.14.6; Node 24.19.0; uv 0.12.3; uv frozen; working tree changes present","gate_id":"security.path-network-regressions","limitation":null,"references":["tests/test_security_boundaries.py","src/qed/security/paths.py","src/qed/security/network.py"],"required":true,"result":"path and restricted-network regression tests passed","status":"passed","utc_date":"2026-08-12"},{"artifact_path":"docs/threat-model.md","artifact_sha256":"62d04f51e53901481c8777507613cc7bda3900e0b292302451e53934c54aaa7a","command":"uv run --frozen pytest tests/test_runtime_stdio.py tests/test_api.py","commit_sha":"df40a9683004ab58fb38497d1aecfc8f1fffa288","dimension":"security","environment":"macOS Darwin; Python 3.14.6; Node 24.19.0; uv 0.12.3; uv frozen; working tree changes present","gate_id":"security.protocol-limits","limitation":null,"references":["tests/test_runtime_stdio.py","tests/test_api.py","src/qed/runtime/stdio.py"],"required":true,"result":"typed protocol frame, notification routing, bounded queue, SSE quota, and replay tests passed","status":"passed","utc_date":"2026-08-12"},{"artifact_path":"artifacts/golden-bundle/manifest.json","artifact_sha256":"1f1f42f2780c67cd41aa3caf5b3d333be3e8575f9a3f68280900fd43b070861f","command":"uv run --frozen qed verify-bundle artifacts/golden-bundle --json","commit_sha":"df40a9683004ab58fb38497d1aecfc8f1fffa288","dimension":"security","environment":"macOS Darwin; Python 3.14.6; Node 24.19.0; uv 0.12.3; uv frozen; working tree changes present","gate_id":"security.offline-bundle","limitation":"The fixture proves integrity and policy recomputation, not signature authenticity or real Codex reliability.","references":["src/qed/bundle_verifier.py","artifacts/golden-bundle"],"required":true,"result":"valid=true; decision=PASS; signature_status=unsigned","status":"passed","utc_date":"2026-08-12"},{"artifact_path":"docs/research/security-findings-closeout-v2-stable.json","artifact_sha256":"7b23beb4a3bc356e6033caf0ffdf6bb0ffe10d2718766e4390f4cf1abb75b759","command":"Codex Security release review","commit_sha":"df40a9683004ab58fb38497d1aecfc8f1fffa288","dimension":"security","environment":"macOS Darwin; Python 3.14.6; Node 24.19.0; uv 0.12.3; uv frozen; working tree changes present","gate_id":"security.baseline-scan-closeout","limitation":"The candidate remediation map has owner/date/evidence for all eight baseline findings, but delegated workers were unavailable and a release-window independent closeout is still required.","references":["docs/research/security-findings-closeout-v2-stable.json","artifacts/security-diff-scan-v2-stable/report.md","docs/research/v2-stable-roadmap.md","docs/threat-model.md"],"required":true,"result":"official diff review found 0 reportable findings with 104/104 file receipts, but coverage is partial","status":"blocked","utc_date":"2026-08-12"},{"artifact_path":"docs/research/security-export-scan-v2-stable.json","artifact_sha256":"a851efe9d5bea3472fc677c527f474d397b198545c480d5461d06a2c797806ee","command":"uv run --frozen python scripts/security_export_scan.py","commit_sha":"df40a9683004ab58fb38497d1aecfc8f1fffa288","dimension":"security","environment":"macOS Darwin; Python 3.14.6; Node 24.19.0; uv 0.12.3; uv frozen; working tree changes present","gate_id":"security.secret-export-scan","limitation":null,"references":["scripts/security_export_scan.py"],"required":true,"result":"production provider/unsafe scan and golden-bundle secret scan are clean","status":"passed","utc_date":"2026-08-12"},{"artifact_path":"artifacts/golden-bundle/manifest.json","artifact_sha256":"1f1f42f2780c67cd41aa3caf5b3d333be3e8575f9a3f68280900fd43b070861f","command":"uv run --frozen pytest tests/test_decision.py tests/test_bundle_verifier.py","commit_sha":"df40a9683004ab58fb38497d1aecfc8f1fffa288","dimension":"mathematics","environment":"macOS Darwin; Python 3.14.6; Node 24.19.0; uv 0.12.3; uv frozen; working tree changes present","gate_id":"mathematics.policy-n-of-n","limitation":null,"references":["src/qed/decision.py","src/qed/stable_contracts.py"],"required":true,"result":"application code requires all stable verifier roles and independent threads","status":"passed","utc_date":"2026-08-12"},{"artifact_path":"artifacts/golden-bundle/manifest.json","artifact_sha256":"1f1f42f2780c67cd41aa3caf5b3d333be3e8575f9a3f68280900fd43b070861f","command":"uv run --frozen pytest tests/test_workflow.py tests/test_bundle_verifier.py","commit_sha":"df40a9683004ab58fb38497d1aecfc8f1fffa288","dimension":"mathematics","environment":"macOS Darwin; Python 3.14.6; Node 24.19.0; uv 0.12.3; uv frozen; working tree changes present","gate_id":"mathematics.claim-graph","limitation":null,"references":["src/qed/stable_contracts.py","src/qed/workflow.py"],"required":true,"result":"UTF-8 byte spans, stable claim IDs, dependency/cycle checks, and coverage checks passed","status":"passed","u